{
  "schema_version": "1.0.0",
  "artifact": "growatt_generic_source_claims",
  "generated_by": "tools/build_fc04_source_research.py",
  "sources": [
    {
      "source_id": "gii_5d_source_review",
      "source_type": "SOURCE_RESEARCH_REVIEW",
      "artifact": "sources/evidence/gii-pipeline-5d-fc04-source-research.json",
      "sha256": "e27e9fb681053c14f7802676b4cc7f4e8a9ba2a0c82a756e7921b97d1ef6ccbf"
    },
    {
      "source_id": "vendor_v124_pdf",
      "source_type": "VENDOR_DOCUMENT_CLAIM",
      "artifact": "Growatt Inverter Modbus RTU Protocol II V1.24 PDF (metadata-only source)",
      "sha256": "fac88d609d74ff6b3c9c31ed65370d166d1fb17461e91b4b4855018fe232a320"
    },
    {
      "source_id": "vendor_v124_tables",
      "source_type": "VENDOR_DOCUMENT_CLAIM",
      "artifact": "sources/vendor/growatt-v1.24-tables.json",
      "sha256": "da2cc5349d0cf52498bac854bf5a477a0b64fe4e08475c6f47c216462d7e08d7"
    },
    {
      "source_id": "grott_t06nnnnxmod",
      "source_type": "EXTERNAL_IMPLEMENTATION_CLAIM",
      "artifact": "sources/external/grott-register-layouts.snapshot.json",
      "sha256": "860202e5b26c1392cd882a5630f4da807e5d35299f52b76c9bfcf7c1f4e07baa"
    },
    {
      "source_id": "curated_input_review",
      "source_type": "HUMAN_REVIEW_CLAIM",
      "artifact": "sources/curated/growatt-registers-best-guess.json",
      "sha256": "3c200232581d789b3ccf0e28cba89e341cb0a6859a9224f26a0ae31735e98867"
    },
    {
      "source_id": "canonical_5c_snapshot",
      "source_type": "HUMAN_REVIEW_CLAIM",
      "artifact": "spec/growatt-register-spec.json",
      "sha256": "e692d646e34040af999ba4854f65803e4218e184d9e04f2982c06d60782ee405"
    },
    {
      "source_id": "retained_live_evidence",
      "source_type": "LIVE_MODBUS_OBSERVATION",
      "artifact": "sources/evidence/min-6000tl-xh-live-validation.json",
      "sha256": "7eb21e0364e5d0c8b1b00fc39f7b2116cd55369935040f9e66f238a9325fd67d"
    },
    {
      "source_id": "retained_cloud_evidence",
      "source_type": "GROWATT_CLOUD_API_OBSERVATION",
      "artifact": "sources/evidence/min-6000tl-xh-cloud-oracle-validation.json",
      "sha256": "95c6cd930194d2b6af04c161781b555a5de3f6555db8c1de52266210d53f519b"
    }
  ],
  "source_type_vocabulary": [
    "SOURCE_RESEARCH_REVIEW",
    "VENDOR_DOCUMENT_CLAIM",
    "EXTERNAL_IMPLEMENTATION_CLAIM",
    "HUMAN_REVIEW_CLAIM",
    "LIVE_MODBUS_OBSERVATION",
    "GROWATT_CLOUD_API_OBSERVATION"
  ],
  "claims": [
    {
      "claim_id": "gii_5d_source_review:input:3085:physical_layout",
      "source_id": "gii_5d_source_review",
      "source_type": "SOURCE_RESEARCH_REVIEW",
      "subject": {
        "namespace": "MODBUS",
        "family_scope": [
          "min_tl_xh"
        ],
        "table": "input",
        "address": 3085
      },
      "assertion": {
        "kind": "property_support",
        "value": {
          "property": "physical_layout",
          "status": "SUPPORTED",
          "value": "one FC04 input word",
          "evidence_refs": [
            "vendor_v124_pdf:p74",
            "vendor_v124_tables:/input/687",
            "grott_t06nnnnxmod:reserved3085"
          ],
          "contradictions": [
            "Holding register 3085 is ComAddress in V1.24; the holding/input table distinction is material and the addresses must not be merged."
          ]
        }
      },
      "provenance": {
        "source_artifact": "sources/evidence/gii-pipeline-5d-fc04-source-research.json",
        "source_sha256": "e27e9fb681053c14f7802676b4cc7f4e8a9ba2a0c82a756e7921b97d1ef6ccbf",
        "source_property_evidence": [
          "vendor_v124_pdf:p74",
          "vendor_v124_tables:/input/687",
          "grott_t06nnnnxmod:reserved3085"
        ]
      },
      "scope": {
        "family": [
          "min_tl_xh"
        ],
        "model": "MIN/TL-XH",
        "protocol_revision": "V1.24",
        "applicability": "5D source-research review of FC04 input cohort"
      },
      "evidence": {
        "method": "property_level_source_review",
        "confidence": "high",
        "status": "resolved",
        "grade": [
          "S2"
        ]
      }
    },
    {
      "claim_id": "gii_5d_source_review:input:3085:word_length",
      "source_id": "gii_5d_source_review",
      "source_type": "SOURCE_RESEARCH_REVIEW",
      "subject": {
        "namespace": "MODBUS",
        "family_scope": [
          "min_tl_xh"
        ],
        "table": "input",
        "address": 3085
      },
      "assertion": {
        "kind": "property_support",
        "value": {
          "property": "word_length",
          "status": "SUPPORTED",
          "value": 1,
          "evidence_refs": [
            "grott_t06nnnnxmod:register_count=1"
          ],
          "contradictions": [
            "Holding register 3085 is ComAddress in V1.24; the holding/input table distinction is material and the addresses must not be merged."
          ]
        }
      },
      "provenance": {
        "source_artifact": "sources/evidence/gii-pipeline-5d-fc04-source-research.json",
        "source_sha256": "e27e9fb681053c14f7802676b4cc7f4e8a9ba2a0c82a756e7921b97d1ef6ccbf",
        "source_property_evidence": [
          "grott_t06nnnnxmod:register_count=1"
        ]
      },
      "scope": {
        "family": [
          "min_tl_xh"
        ],
        "model": "MIN/TL-XH",
        "protocol_revision": "V1.24",
        "applicability": "5D source-research review of FC04 input cohort"
      },
      "evidence": {
        "method": "property_level_source_review",
        "confidence": "high",
        "status": "resolved",
        "grade": [
          "S2"
        ]
      }
    },
    {
      "claim_id": "gii_5d_source_review:input:3085:semantic_quantity",
      "source_id": "gii_5d_source_review",
      "source_type": "SOURCE_RESEARCH_REVIEW",
      "subject": {
        "namespace": "MODBUS",
        "family_scope": [
          "min_tl_xh"
        ],
        "table": "input",
        "address": 3085
      },
      "assertion": {
        "kind": "property_support",
        "value": {
          "property": "semantic_quantity",
          "status": "SUPPORTED",
          "value": "reserved_or_unsupported",
          "evidence_refs": [
            "vendor_v124_pdf:p74:Reserved",
            "grott_t06nnnnxmod:reserved3085"
          ],
          "contradictions": [
            "Holding register 3085 is ComAddress in V1.24; the holding/input table distinction is material and the addresses must not be merged."
          ]
        }
      },
      "provenance": {
        "source_artifact": "sources/evidence/gii-pipeline-5d-fc04-source-research.json",
        "source_sha256": "e27e9fb681053c14f7802676b4cc7f4e8a9ba2a0c82a756e7921b97d1ef6ccbf",
        "source_property_evidence": [
          "vendor_v124_pdf:p74:Reserved",
          "grott_t06nnnnxmod:reserved3085"
        ]
      },
      "scope": {
        "family": [
          "min_tl_xh"
        ],
        "model": "MIN/TL-XH",
        "protocol_revision": "V1.24",
        "applicability": "5D source-research review of FC04 input cohort"
      },
      "evidence": {
        "method": "property_level_source_review",
        "confidence": "high",
        "status": "resolved",
        "grade": [
          "S2"
        ]
      }
    },
    {
      "claim_id": "gii_5d_source_review:input:3085:applicability",
      "source_id": "gii_5d_source_review",
      "source_type": "SOURCE_RESEARCH_REVIEW",
      "subject": {
        "namespace": "MODBUS",
        "family_scope": [
          "min_tl_xh"
        ],
        "table": "input",
        "address": 3085
      },
      "assertion": {
        "kind": "property_support",
        "value": {
          "property": "applicability",
          "status": "SUPPORTED",
          "value": "MIN/TL-XH V1.24 FC04 input table",
          "evidence_refs": [
            "vendor_v124_pdf:p74"
          ],
          "contradictions": [
            "Holding register 3085 is ComAddress in V1.24; the holding/input table distinction is material and the addresses must not be merged."
          ]
        }
      },
      "provenance": {
        "source_artifact": "sources/evidence/gii-pipeline-5d-fc04-source-research.json",
        "source_sha256": "e27e9fb681053c14f7802676b4cc7f4e8a9ba2a0c82a756e7921b97d1ef6ccbf",
        "source_property_evidence": [
          "vendor_v124_pdf:p74"
        ]
      },
      "scope": {
        "family": [
          "min_tl_xh"
        ],
        "model": "MIN/TL-XH",
        "protocol_revision": "V1.24",
        "applicability": "5D source-research review of FC04 input cohort"
      },
      "evidence": {
        "method": "property_level_source_review",
        "confidence": "high",
        "status": "resolved",
        "grade": [
          "S2"
        ]
      }
    },
    {
      "claim_id": "gii_5d_source_review:input:3085:scale",
      "source_id": "gii_5d_source_review",
      "source_type": "SOURCE_RESEARCH_REVIEW",
      "subject": {
        "namespace": "MODBUS",
        "family_scope": [
          "min_tl_xh"
        ],
        "table": "input",
        "address": 3085
      },
      "assertion": {
        "kind": "property_review",
        "value": {
          "property": "scale",
          "status": "NOT_APPLICABLE",
          "value": null,
          "evidence_refs": [],
          "contradictions": [
            "Holding register 3085 is ComAddress in V1.24; the holding/input table distinction is material and the addresses must not be merged."
          ]
        }
      },
      "provenance": {
        "source_artifact": "sources/evidence/gii-pipeline-5d-fc04-source-research.json",
        "source_sha256": "e27e9fb681053c14f7802676b4cc7f4e8a9ba2a0c82a756e7921b97d1ef6ccbf",
        "source_property_evidence": []
      },
      "scope": {
        "family": [
          "min_tl_xh"
        ],
        "model": "MIN/TL-XH",
        "protocol_revision": "V1.24",